<?xml version="1.0" encoding="UTF-8"?>
<!-- Address xml with target namespace for AddressSchema -->
<address xmlns="http://www.bfh.ch/AddressSchema" 
    xmlns:xsi="http://www.w3.org/2001/XMLSchema-instance"
	xsi:schemaLocation="http://www.bfh.ch/AddressSchema
                         ./address_tns.xsd">
	<firstname>John</firstname>
	<name>Smith</name>
	<title>Master of Arts</title>
	<street>45th Avenue</street>
	<number>12</number>
	<apt-number>15</apt-number>
	<city>New York</city>
	<zip>10003</zip>
	<country>USA</country>
</address>